,query,paper,response
0,What does this report talk about?Please explain in detail.,data_output_reports/data_reports_7,"Based on the provided portions of the document, the report primarily focuses on the importance of adopting digital and analytics capabilities, particularly artificial intelligence (AI), in global supply chain networks. It highlights the need for supply chain leaders to identify and respond to long-term challenges and opportunities through the gathering and analysis of large amounts of data.

The report emphasizes that AI and other analytics tools can collect and analyze vast amounts of information related to customers, suppliers, and market conditions. By uncovering hidden relationships within this data, supply chain professionals can make strategic decisions and plan responses based on facts. It mentions that AI systems require current and accurate data from multiple sources to be effective.

However, the report also points out that many companies tend to underinvest in AI and related technologies for their supply chains. While a majority of respondents in a survey recognized the significance of developing digital and analytics capabilities, only a smaller percentage actually invest at least $5 million annually in these areas. The reasons for this discrepancy between recognition and investment are not elaborated in the provided text.

The report discusses the challenges and implications of lacking central ownership in the C-suite for digital and analytics initiatives. It highlights the historical siloed approach to technology enhancements, where IT is used to improve specific functions or units without comprehensive integration. The report suggests that having central ownership and accountability is crucial to scaling up technology initiatives across the entire company and gaining a holistic understanding of the customer.

The document also touches on the importance of readiness to deploy digital and analytics capabilities across the supply network. It poses a series of questions to assess an organization's readiness in terms of data and infrastructure preparation, identification of high-profile opportunities, and building a technically savvy workforce.

Additionally, the report mentions the challenges faced by companies in building and implementing digital and analytics initiatives within their supply chain. It highlights the shortage of people with leading-edge digital and analytics skills and the need to build a more technically and analytically skilled supply chain workforce. The report discusses the strategies companies are adopting, such as hiring individuals with technical backgrounds, retraining existing personnel, and leveraging external resources for expertise.

Overall, the report emphasizes the need for companies to recognize the transformative potential of digital and analytics initiatives in their supply chains, invest in these capabilities, and build the necessary talent and infrastructure to fully leverage them."
